{
  "artifacts": [
    {
      "byte_size": 3710,
      "media_type": "text/markdown",
      "path": "V3/PHASE_3B_CLOSURE_REMEDIATION_BUILD_REPORT.md",
      "producing_command": "manifest_generation",
      "role": "closure_build_report",
      "sha256": "e0706c39f418f1142724a1bfc472f813f908e037b0cd1eaee78ab46c7111b21c"
    },
    {
      "byte_size": 7664,
      "media_type": "text/markdown",
      "path": "V3/REQUIREMENTS_TRACEABILITY.md",
      "producing_command": "manifest_generation",
      "role": "requirements_traceability",
      "sha256": "b2305f442bc6731d7be305c0a97fea2d03ee2f58b4f22b4059ab8bff644bb40f"
    },
    {
      "byte_size": 163968,
      "media_type": "application/zip",
      "path": "dist/agentnative-2.0.0a1-py3-none-any.whl",
      "producing_command": "wheel_smoke",
      "role": "wheel",
      "sha256": "32e84779dda3a5fdcadef7c6996eb13df9bed2ca24089f8b931e35e64075bfa2"
    },
    {
      "byte_size": 202,
      "media_type": "application/json",
      "path": "V3/evidence/gate2/structured_test_result.json",
      "producing_command": "baseline_tests",
      "role": "structured_test_result",
      "sha256": "7d38fa79161410861b6d699d416b730a8fcfdf43526cef5834d589b3788d8833"
    },
    {
      "byte_size": 4306,
      "media_type": "application/json",
      "path": "V3/evidence/gate2/phase2b_mutation_result.json",
      "producing_command": "phase2b_mutations",
      "role": "phase2b_mutation_result",
      "sha256": "1136d0dbc62241818c38097b8062adb5a4747502c0de9b5eeb539f165cb81bbf"
    },
    {
      "byte_size": 6994,
      "media_type": "application/json",
      "path": "V3/evidence/gate2/phase2c_mutation_result.json",
      "producing_command": "phase2c_mutations",
      "role": "phase2c_mutation_result",
      "sha256": "b973843d4bc69cb75ce6966b44bbd1ca32d6cf924d28a1757860b7e0be918ade"
    },
    {
      "byte_size": 39447,
      "media_type": "application/json",
      "path": "V3/evidence/gate2/phase3_mutation_result.json",
      "producing_command": "phase3_mutations",
      "role": "phase3_mutation_result",
      "sha256": "45ec0778c9b963b85900e86029266f7af2449d0eeecaeeda21f8871c002e4bfe"
    },
    {
      "byte_size": 81074,
      "media_type": "application/json",
      "path": "V3/evidence/gate2/wheel_smoke_result.json",
      "producing_command": "wheel_smoke",
      "role": "wheel_smoke_result",
      "sha256": "a0521ff8109fb65e11e05febf0e69f01d9cb7283112c595577a2392b18b2c0a2"
    },
    {
      "byte_size": 6505,
      "media_type": "application/json",
      "path": "V3/evidence/gate2/evidence_tamper_matrix.json",
      "producing_command": "evidence_tamper_matrix",
      "role": "tamper_matrix",
      "sha256": "d2f53c3f42d5b032b1e5ab09556ed4d725fdf1a2fc623bac6b47092b9f38f556"
    },
    {
      "byte_size": 3287,
      "media_type": "text/markdown",
      "path": "V3/PHASE_3B_GATE2_PROOF_REMEDIATION_BUILD_REPORT.md",
      "producing_command": "manifest_generation",
      "role": "gate2_build_report",
      "sha256": "44f811902d33ec885e3b01e94fd81e99899d53ee0383a822ca10261925045c61"
    }
  ],
  "ci": {
    "completed_at": "2026-09-29T05:21:02.024079Z",
    "conclusion": "success",
    "created_at": "2026-09-29T05:21:02.024079Z",
    "event": "local",
    "head_sha": "6ac1113ebf032c60856c4722150481cd5441e1cd",
    "repository": "revanthpp/agent-native",
    "run_attempt": 1,
    "run_id": 1,
    "started_at": "2026-09-29T05:21:02.024079Z",
    "status": "completed",
    "uploaded_artifact": {
      "digest": "0000000000000000000000000000000000000000000000000000000000000000",
      "id": 1,
      "name": "phase3b-gate2-builder-bundle",
      "url": "https://github.com/revanthpp/agent-native/actions/artifacts/1"
    },
    "url": "https://github.com/revanthpp/agent-native/actions/runs/1",
    "workflow_path": ".github/workflows/ci.yml"
  },
  "commands": [
    {
      "argv": [
        "/Volumes/AI L&D/AI Projects/L&D/Agent Native/.venv/bin/python",
        "-m",
        "pytest",
        "-q",
        "--import-mode=importlib",
        "--ignore=audit_v2",
        "--junitxml",
        "V3/evidence/gate2/baseline_tests.xml",
        "tests"
      ],
      "artifact_refs": [
        "structured_test_result"
      ],
      "ended_at": "2026-09-29T05:20:07.445135Z",
      "environment": {
        "github_repository": "local",
        "github_run_id": "local",
        "python": "3.14.3"
      },
      "exit_code": 0,
      "id": "baseline_tests",
      "output": {
        "stderr": "",
        "stdout": ".................................. [ 22%]\n................................................. [ 55%]\n................................................... [ 89%]\n...............                                                      [100%]\n149 passed, 158 subtests passed in 9.10s\n"
      },
      "output_sha256": "18d1aae3a61eb4e2ec7f21d95b0b3eca2f20e9c904e9c6171d823d257cb8f3c3",
      "result_counts": {
        "failed": 0,
        "passed": 307,
        "skipped": 0,
        "total": 307
      },
      "started_at": "2026-09-29T05:19:58.159433Z"
    },
    {
      "argv": [
        "/Volumes/AI L&D/AI Projects/L&D/Agent Native/.venv/bin/python",
        "scripts/run_phase2b_mutations.py",
        "--output",
        "V3/evidence/gate2/phase2b_mutation_result.json"
      ],
      "artifact_refs": [
        "phase2b_mutation_result"
      ],
      "ended_at": "2026-09-29T05:20:07.577842Z",
      "environment": {
        "github_repository": "local",
        "github_run_id": "local",
        "python": "3.14.3"
      },
      "exit_code": 0,
      "id": "phase2b_mutations",
      "output": {
        "stderr": "",